<?xml version="1.0" encoding="UTF-8"?>
<?xml-stylesheet type="text/css" href="style.css"?>
<in xmlns:xsi="http://www.w3.org/2001/XMLSchema-instance" xsi:schemaLocation="scheme.xsd">
	<info>
		<university>БГУиР</university>
		<points>356</points>
		<plan>50 человек</plan>
		<city>Минск</city>
	</info>
	<info>
		<university>Другой универ</university>
		<points>401</points>
		<plan>0 человек</plan>
		<city>Дреговичи</city>
	</info>
</in>